abbr.;LEN;full_name_local;full_name_english;country
;0;Společný podnik;Joint venture;CZ
;0;Zájmové sdružení;Special interest club;CZ
;0;Nadace;Foundation;CZ
;0;Nadační fond;Foundation fund;CZ
;0;Komoditní burza;Commodity exchange;CZ
;0;Garanční fond obchodníků s cennými papíry;Guarantee Fund of Investment Firms;CZ
;0;Ústav;Institute;CZ
;0;Družstvo;Cooperative;CZ
;0;Česká národní banka;Czech National Bank;CZ
;0;Organizační složka státu;Organisational unit of the state;CZ
;0;Stálý rozhodčí soud;Permanent Court of Arbitration;CZ
;0;Příspěvková organizace;Subsidised organisation, semi-budgetary organisation;CZ
;0;Správa železniční dopravní cesty, státní organizace;Railway Transport Route Administration (state organisation);CZ
;0;Rada pro veřejný dohled nad auditem;Council for Public Audit Supervision;CZ
;0;Veřejnoprávní instituce (ČT,ČRo,ČTK);Public law institution (Czech Television, Czech Radio, Czech Press Agency);CZ
;0;Fond (ze zákona);Fund (statutory);CZ
;0;Zdravotní pojišťovna;Health insurance company;CZ
;0;Odštěpný závod nebo jiná organizační složka podniku zapisující se do obchodního rejstříku;Branch or other organisational unit of an incorporated enterprise;CZ
;0;Samostatná drobná provozovna obecního úřadu;Independent small office of a municipal office;CZ
;0;Podílový nebo penzijní fond;Unit trust or pension fund;CZ
;0;Vysoká škola;University, college;CZ
;0;Školská právnická osoba;Educational legal entity;CZ
;0;Veřejná výzkumná instituce;Public research institution;CZ
;0;Odborová organizace a organizace zaměstnavatelů;Trade union organisation and emloyers’ organisation;CZ
;0;Zvláštní organizace pro zastoupení českých zájmů v mezinárodních nevládních organizacích;Special organisation to represent Czech interests in international non-governmental organisations;CZ
;0;Podnik nebo hospodářské zařízení sdružení;Enterprise or economic organisation of an association;CZ
;0;Spolek;Society;CZ
;0;Politická strana, politické hnutí;Political party, political movement;CZ
;0;Podnik nebo hospodářské zařízení politické strany;Enterprise or economic organisation of a political party;CZ
;0;Církevní organizace a náboženské společnosti;Church organisation and religious societes;CZ
;0;Evidované církevní právnické osoby;Registered church (legal entity);CZ
;0;Svazy církví a náboženských společností ;Unions of churches and religious societies;CZ
;0;Organizační jednotka sdružení;Organisational unit of an association;CZ
;0;Organizační jednotka politické strany nebo politického hnutí;Organisational unit of a political party or political movement;CZ
;0;Organizační jednotka odborové organizace a organizace zaměstnavatelů;Organisational unit of a trade union organisation and emloyers’ organisation;CZ
;0;Organizační jednotka zvláštní organizace pro zastoupení českých zájmů v mezinárodních nevládních organizacích;Organisational unit of the special organisation to represent Czech interests in international non-governmental organisations;CZ
;0;Pobočný spolek;Subsidiary society;CZ
;0;Stavovská organizace - profesní komora;Professional chamber;CZ
;0;Komora (s výjimkou profesních komor);Chamber (excluding professional chambers);CZ
;0;Zájmové sdružení právnických osob;Special interest club of legal entities;CZ
;0;Honební společenstvo;Hunting society;CZ
;0;Svazek obcí;Union of municipalities;CZ
;0;Obec nebo městská část hlavního města Prahy;Municipality or city district of Prague;CZ
;0;Kraj a hlavní město Praha;Region or capital city Prague;CZ
;0;Regionální rada regionu soudržnosti;Regional Council of a cohesion region;CZ
;0;Zastupitelský orgán jiných států;Representative office of another state;CZ
;0;Mezinárodní odborová organizace;International trade union organisation;CZ
;0;Mezinárodní organizace zaměstnavatelů;International organisation of employers;CZ
;0;Mezinárodní nevládní organizace;International non-governmental organisation;CZ
;0;Organizační jednotka mezinárodní nevládní organizace;Organisational unit of the international non-governmental organisation;CZ
;0;Pobočná mezinárodní odborová organizace;Subsidiary international trade union organisation;CZ
;0;Pobočná mezinárodní organizace zaměstnavatelů;Subsidiary international organisation of employers;CZ
;0;Subjekt právním řádem výslovně neupravený;Entity not explicitly defined by law;CZ
;0;Právnická osoba zřízená zvláštním zákonem zapisovaná do veřejného rejstříku;Legal entity of an public register established by the special law;CZ
;0;Sonstige Organisation ohne Erwerbszweck;Other non-profit organisation;DE
;0;Erhvervsdrivende fond;Commercial foundation;DK
;0;Forening;Association ;DK
;0;Frivillig forening;Voluntary association;DK
;0;Andelsselskab (-forening);Cooperative society;DK
;0;Forening eller selskab med begr. ansvar;Limited liability association or company;DK
;0;Dødsbo;Estate of deceased person;DK
;0;Statslig administrativ enhed;Entitiy of central government;DK
;0;Selvstændig offentlig virksomhed;Independent public company;DK
;0;Amtskommune;County;DK
;0;Region;Region;DK
;0;Primærkommune;Municipality;DK
;0;Folkekirkelige Institutioner;Establishmentarian church institution;DK
;0;Enhed under oprettelse i E&S;Unit under creation in business register;DK
;0;Øvrige virksomhedsformer;Other companies;DK
;0;Særlig Finansiel virksomhed;Special financial company;DK
;0;Interessentskab;General partnership;DK
;0;Kommanditselskab;Limited partnership;DK
;0;Medarbejderinvesteringsselskab;Employee investment company;DK
;0;Partrederi;Shipping partnership;DK
;0;Aktieselskab;Limited company ;DK
;0;Kommanditaktieselskab;Limited partnership with a share capital;DK
;0;Fonde og andre selvejende institutioner;Self-governing institution, association, foundation etc.;DK
;0;Uoplyst virksomhedsform;Unknown legal form;DK
;0;Sociedad Civil con personalidad jurídica;Non-commercial partnership with independent legal status;ES
;0;Mutua;Mutual company;ES
;0;Otras formas jurídicas;Other legal forms;ES
;0;Fundación;Foundation;ES
;0;Asociaciones y otras instituciones sin fines de lucro a servicio de los hogares;Associations and other non-profit institutions serving households;ES
;0;Entidad de derecho público;Public law entity;ES
;0;Patrimonio de inversión sin personalidad jurídica;Investment funds without independent legal status;ES
;0;Avoin yhtiö;General partnership;FI
;0;Keskinäinen kiinteistö-Oy;Mutual joint-stock property company;FI
;0;Muu kiinteistö Oy (ei-keskinäinen);Other joint-stock property company (not mutual);FI
;0;Konserni;Enterprise group;FI
;0;Muu yhtiö;Other enterprise;FI
;0;Aatteellinen yhdistys;Voluntary association;FI
;0;Erityislainsäädäntöön perustuva yhdistys;Association based on separate legislation;FI
;0;Keskinäinen vahinkovakuutusyhdistys;Mutual indemnity insurance association;FI
;0;Metsänhoitoyhdistys;Forestry society;FI
;0;Avustuskassa;Mutual benefit society;FI
;0;Työttömyyskassa;Unemployment fund;FI
;0;Muu taloudellinen yhdistys;Other economic association;FI
;0;Muu yhdistys;Other association;FI
;0;Eläkesäätiö (säädekirjalla perustettu);Pension foundation (founded by a charter of foundation);FI
;0;Työeläkekassa;Pension fund;FI
;0;Hypoteekkiyhdistys;Mortgage society;FI
;0;Muu säätiö;Other foundation;FI
;0;Valtio ja sen laitokset;State and its agencies;FI
;0;Kunta;Municipality;FI
;0;Kuntayhtymä;Joint municipal board;FI
;0;Ahvenanmaan maakunta ja sen virastot;Region of Åland and its agencies;FI
;0;Evankelis-luterilainen kirkko;Evangelical Lutheran Church;FI
;0;Ortodoksinen kirkko;Greek Orthodox Church;FI
;0;Rekisteröity uskonnollinen yhdyskunta;Registered religious community;FI
;0;Ylioppilaskunta tai osakunta;Students' union or association;FI
;0;Erillishallinnollinen valtion laitos;Governmental institution with separate administration;FI
;0;Muu julkisoikeudellinen oikeushenkilö;Other legal person subject to public law;FI
;0;Yhteisetuudet (esim. kalastuskunta);Mutual interest bodies (e.g. fishery collectives);FI
;0;Yhteismetsä;Jointly owned forest;FI
;0;Maatila;Farm;FI
;0;Valtion liikelaitos;State-owned company;FI
;0;Kunnallinen liikelaitos;Municipally-owned company;FI
;0;Kuntainliiton (kuntayhtymän) liikelaitos;Joint local authority company;FI
;0;Ahvenanmaan liikelaitos;Company owned by the Regional Government of Åland;FI
;0;Muut (esim. tilapäinen oikeudellinen muoto);Others (e.g. temporary legal form);FI
;0;Indivision avec personne morale ;Co-ownership with the status of legal entity;FR
;0;Société créée de fait entre personnes physiques ;De facto company created between natural persons;FR
;0;Société créée de fait avec personne morale ;De facto company created with a legal entity;FR
;0;Société en participation entre personnes physiques ;Joint venture between natural persons;FR
;0;Société en participation avec personne morale ;Joint venture with a legal entity;FR
;0;Société en participation de professions libérales ;Joint venture between professionals;FR
;0;Fiducie ;Trust;FR
;0;Paroisse hors zone concordataire ;Parish not subject to concordat law;FR
;0;Autre groupement de droit privé non doté de la personnalité morale ;Other private-law group not having legal personality;FR
;0;Établissement public national à caractère industriel ou commercial doté d'un comptable public ;National industrial or commercial public undertaking having a public accountant;FR
;0;Établissement public national à caractère industriel ou commercial non doté d'un comptable public ;National industrial or commercial public undertaking not having a public accountant;FR
;0;Exploitant public ;Public operator;FR
;0;Établissement public local à caractère industriel ou commercial ;Local industrial or commercial public undertaking;FR
;0;Régie d'une collectivité locale à caractère industriel ou commercial ;Management of an industrial or commercial local authority;FR
;0;Institution Banque de France ;Bank of France institution;FR
;0;Société de caution mutuelle ;Mutual guarantee company;FR
;0;Société coopérative de banque populaire ;A popular bank cooperative;FR
;0;Caisse de crédit maritime mutuel ;Mutual maritime lending institution;FR
;0;Caisse (fédérale) de crédit mutuel ;(Federal) mutal lending institution;FR
;0;Association coopérative inscrite (droit local Alsace Moselle) ;Registered cooperative association (local law of Alsace Moselle);FR
;0;Caisse d'épargne et de prévoyance à forme coopérative ;Cooperative savings and provident bank;FR
;0;Société en nom collectif ;Commercial partnership;FR
;0;Société en nom collectif coopérative ;Cooperative commercial partnership;FR
;0;Société en commandite simple ;Ordinary limited partnership;FR
;0;Société en commandite simple coopérative ;Ordinary cooperative limited partnership;FR
;0;Société en commandite par actions ;Partnership limited by shares;FR
;0;Société en commandite par actions coopérative ;Cooperative partnership limited by shares;FR
;0;Société d'exercice libéral en commandite par actions ;Partnership limited by shares for a professional private practice;FR
;0;SARL nationale ;National limited liability company;FR
;0;SARL d'économie mixte ;Mixed economy limited liability company;FR
;0;SARL immobilière pour le commerce et l'industrie (SICOMI) ;Limited liability real estate company for trade and industry;FR
;0;SARL immobilière de gestion;Limited liability real estate management company;FR
;0;SARL d'aménagement foncier et d'équipement rural (SAFER);Limited liability company for land development and rural establishment;FR
;0;SARL mixte d'intérêt agricole (SMIA) ;Limited liability company with mixed agricultural purposes;FR
;0;SARL d'intérêt collectif agricole (SICA) ;Limited liability company for collective agricultural purposes;FR
;0;SARL d'attribution ;Limited liability allocation company;FR
;0;SARL coopérative de construction ;Cooperative construction limited liability company;FR
;0;SARL coopérative de consommation ;Cooperative consumer limited liability company;FR
;0;SARL coopérative artisanale ;Cooperative craftworkers' limited liability company;FR
;0;SARL coopérative d'intérêt maritime ;Cooperative limited liability company for maritime purposes;FR
;0;SARL coopérative de transport;Cooperative limited liability transport company;FR
;0;SARL coopérative ouvrière de production (SCOP);Cooperative workers' production limited liability company;FR
;0;SARL union de sociétés coopératives ;Limited liability union of cooperative companies;FR
;0;Autre SARL coopérative ;Other cooperative limited liability company;FR
;0;Société d'exercice libéral à responsabilité limitée ;Limited liability company for a professional private practice;FR
;0;SARL unipersonnelle ;Single-person limited liability company;FR
;0;Société à responsabilité limitée (sans autre indication);Limited liability company (with no further details);FR
;0;SA à participation ouvrière à conseil d'administration ;Workers' cooperative in the form of a public limited company with a board of directors;FR
;0;SA nationale à conseil d'administration ;National public limited company with a board of directors;FR
;0;SA d'économie mixte à conseil d'administration ;Mixed economy public limited company with a board of directors;FR
;0;Société d'investissement à capital variable (SICAV) à conseil d'administration ;Open-end investment company with a board of directors;FR
;0;SA immobilière pour le commerce et l'industrie (SICOMI) à conseil d'administration;Real estate public limited company for trade and industry with a board of directors;FR
;0;SA immobilière d'investissement à conseil d'administration;Real estate investment public limited company with a board of directors;FR
;0;SA d'aménagement foncier et d'équipement rural (SAFER) à conseil d'administration;Public limited company for land development and rural establishment with a board of directors;FR
;0;Société anonyme mixte d'intérêt agricole (SMIA) à conseil d'administration ;Public limited company with mixed agricultural purposes with a board of directors;FR
;0;SA d'intérêt collectif agricole (SICA) à conseil d'administration;Public limited company for collective agricultural purposes with a board of directors;FR
;0;SA d'attribution à conseil d'administration;Public limited allocation company with a board of directors;FR
;0;SA coopérative de construction à conseil d'administration;Public limited cooperative construction company with a board of directors;FR
;0;SA de HLM à conseil d'administration ;Affordable housing public limited company with a board of directors;FR
;0;SA coopérative de production de HLM à conseil d'administration ;Cooperative affordable housing production public limited company with a board of directors;FR
;0;SA de crédit immobilier à conseil d'administration ;Real estate lending public limited company with a board of directors;FR
;0;SA coopérative de consommation à conseil d'administration ;Consumer cooperative public limited company with a board of directors;FR
;0;SA coopérative de commerçants-détaillants à conseil d'administration;Retailers' cooperative public limited company with a board of directors ;FR
;0;SA coopérative artisanale à conseil d'administration ;Cooperative craftworkers' public limited company with a board of directors;FR
;0;SA coopérative (d'intérêt) maritime à conseil d'administration ;Cooperative public limited company for maritime purposes with a board of directors;FR
;0;SA coopérative de transport à conseil d'administration;Cooperative transport public limited company with a board of directors;FR
;0;SA coopérative ouvrière de production (SCOP) à conseil d'administration;Cooperative workers' production public limited company with a board of directors;FR
;0;SA union de sociétés coopératives à conseil d'administration ;Union of cooperative companies public limited company with a board of directors;FR
;0;Autre SA coopérative à conseil d'administration ;Other cooperative public limited company with a board of directors;FR
;0;Société de Participations Financières de Profession Libérale Société anonyme à conseil d'administration (SPFPL SA à conseil d'administration);Professional holding company Public liability company with a board of directors;FR
;0;Société d'exercice libéral à forme anonyme à conseil d'administration ;Public limited company for a professional private practice with a board of directors;FR
;0;SA à conseil d'administration (s.a.i.);Public limited company with a board of directors (real estate public limited company);FR
;0;SA à participation ouvrière à directoire ;Workers' cooperative in the form of a public limited company with a management board;FR
;0;SA nationale à directoire ;National public limited company with a management board;FR
;0;SA d'économie mixte à directoire ;Mixed economy public limited company with a management board;FR
;0;Société d'investissement à capital variable (SICAV) à directoire ;Open-end investment company with a management board;FR
;0;SA immobilière pour le commerce et l'industrie (SICOMI) à directoire;Real estate public limited company for trade and industry with a management board;FR
;0;SA immobilière d'investissement à directoire ;Real estate investment public limited company with a management board ;FR
;0;Safer anonyme à directoire ;Public limited company for land development and rural establishment with a management board ;FR
;0;SA mixte d'intérêt agricole (SMIA);Public limited company with mixed agricultural purposes with a management board;FR
;0;SA d'intérêt collectif agricole (SICA);Public limited company for collective agricultural purposes with a management board;FR
;0;SA d'attribution à directoire;Public limited allocation company with a management board;FR
;0;SA coopérative de construction à directoire;Public limited cooperative construction company with a management board;FR
;0;SA de HLM à directoire;Affordable housing public limited company with a management board;FR
;0;Société coopérative de production de HLM anonyme à directoire ;Cooperative affordable housing production public limited company with a management board;FR
;0;SA de crédit immobilier à directoire ;Real estate lending public limited company with a management board;FR
;0;SA coopérative de consommation à directoire ;Consumer cooperative public limited company with a management board;FR
;0;SA coopérative de commerçants-détaillants à directoire;Retailers' cooperative public limited company with a management board;FR
;0;SA coopérative artisanale à directoire ;Cooperative craftworkers' public limited company with a management board;FR
;0;SA coopérative d'intérêt maritime à directoire ;Cooperative public limited company for maritime purposes with a management board;FR
;0;SA coopérative de transport à directoire ;Cooperative transport public limited company with a management board;FR
;0;SA coopérative ouvrière de production (SCOP) à directoire;Cooperative workers' production public limited company with a management board;FR
;0;SA union de sociétés coopératives à directoire ;Union of cooperative companies public limited company with a management board;FR
;0;Autre SA coopérative à directoire;Other cooperative public limited company with a management board;FR
;0;Société de Participations Financières de Profession Libérale Société anonyme à Directoire (SPFPL SA à directoire);Professional holding company Public limited company with a management board;FR
;0;Société d'exercice libéral à forme anonyme à directoire ;Public limited company for a professional private practice with a management board;FR
;0;SA à directoire (s.a.i.);Public limited company with a management board (real estate public limited company);FR
;0;SAS, société par actions simplifiée;Simplified joint stock company;FR
;0;Société par actions simplifiée à associé unique ou société par actions simplifiée unipersonnelle ;Simplified joint stock company with a single shareholder or single person simplified joint stock company;FR
;0;Société d'exercice libéral par action simplifiée ;Simplifed joint stock company for a professional private practice;FR
;0;Société européenne ;European company;FR
;0;Caisse d'Épargne et de Prévoyance ;Savings and provident bank;FR
;0;Société coopérative agricole ;Agricultural cooperative;FR
;0;Union de sociétés coopératives agricoles ;Union of agricultural cooperatives;FR
;0;Société d'assurance à forme mutuelle;Mutual insurance company;FR
;0;Sociétés Interprofessionnelles de Soins Ambulatoires ;Inter-professional outpatient care companies;FR
;0;Société civile d'intérêt collectif agricole (SICA);Civil-law company for collective agricultural purposes;FR
;0;Groupement foncier agricole ;Agricultural land grouping;FR
;0;Groupement agricole foncier ;Agricultural land grouping;FR
;0;Groupement forestier ;Forestry grouping;FR
;0;Groupement pastoral ;Pastoral grouping;FR
;0;Groupement foncier et rural;Land and rural grouping;FR
;0;Société civile foncière ;Land civil-law company;FR
;0;Société civile immobilière ;Property civil-law company;FR
;0;Société civile immobilière de construction-vente;Property civil-law company for construction and sale;FR
;0;Société civile d'attribution ;Civil-law allocation company;FR
;0;Société civile coopérative de construction ;Civil-law construction cooperative company;FR
;0;Société civile immobilière d' accession progressive à la propriété;Property civil-law company for gradual accession to ownership;FR
;0;Société civile coopérative de consommation ;Civil-law cooperative consumer company;FR
;0;Société civile coopérative d'intérêt maritime ;Civil-law company for maritime purposes;FR
;0;Société civile coopérative entre médecins ;Civil-law cooperative company between doctors;FR
;0;Autre société civile coopérative ;Other civil-law cooperative company;FR
;0;SCP d'avocats ;Civil-law professional partnership of lawyers ;FR
;0;SCP d'avocats aux conseils ;Civil-law professional partnership of legal counsel;FR
;0;SCP d'avoués d'appel ;Civil-law professional partnership of solicitors;FR
;0;SCP d'huissiers ;Civil-law professional partnership of bailiffs;FR
;0;SCP de notaires ;Civil-law professional partnership of notaries;FR
;0;SCP de commissaires-priseurs ;Civil-law professional partnership of valuers and auctioneers;FR
;0;SCP de greffiers de tribunal de commerce ;Civil-law professional partnership of clerks of the commercial court;FR
;0;SCP de conseils juridiques ;Civil-law professional partnership of legal advisors;FR
;0;SCP de commissaires aux comptes ;Civil-law professional partnership of auditors;FR
;0;SCP de médecins ;Civil-law professional partnership of doctors;FR
;0;SCP de dentistes ;Civil-law professional partnership of dentists;FR
;0;SCP d'infirmiers ;Civil-law professional partnership of nurses;FR
;0;SCP de masseurs-kinésithérapeutes;Civil-law professional partnership of masseurs and physiotherapists;FR
;0;SCP de directeurs de laboratoire d'analyse médicale ;Civil-law professional partnership of directors of medical analysis laboratories;FR
;0;SCP de vétérinaires ;Civil-law professional partnership of veterinary surgeons;FR
;0;SCP de géomètres experts;Civil-law professional partnership of expert surveyors;FR
;0;SCP d'architectes ;Civil-law professional partnership of architects;FR
;0;Autre société civile professionnelle;Other civil-law professional partnership;FR
;0;Société civile laitière ;Dairy civil-law partnership;FR
;0;Société civile de moyens ;Resourcing civil-law partnership;FR
;0;Caisse locale de crédit mutuel ;Local mutual lending bank;FR
;0;Caisse de crédit agricole mutuel ;Mutual agricultural lending bank;FR
;0;Société civile d'exploitation agricole ;Civil-law partnership for agricultural operations;FR
;0;Exploitation agricole à responsabilité limitée ;Limited liability farm;FR
;0;Autre société civile ;Other civil-law company;FR
;0;Autre personne de droit privé inscrite au registre du commerce et des sociétés;Other private-law person registered in the trade and companies register;FR
;0;Autorité constitutionnelle ;Constitutional authority;FR
;0;Autorité administrative indépendante ;Independent administrative authority;FR
;0;Ministère ;Ministry;FR
;0;Service central d'un ministère ;Central department of a ministry;FR
;0;Service du ministère de la Défense ;Ministry of Defence department;FR
;0;Service déconcentré à compétence nationale d'un ministère (hors Défense);Decentralised department of a ministry (excluding Defence) with national jurisdiction;FR
;0;Service déconcentré de l'État à compétence (inter) régionale ;Decentralised State department with (inter-)regional jurisdiction;FR
;0;Service déconcentré de l'État à compétence (inter) départementale ;Decentralised State department with (inter-)departmental jurisdiction;FR
;0;(Autre) Service déconcentré de l'État à compétence territoriale ;(Other) decentralised State department with territorial jurisdiction;FR
;0;Ecole nationale non dotée de la personnalité morale ;National school not having legal entity status;FR
;0;Commune et commune nouvelle ;Municipality and new municipality;FR
;0;Département ;Department;FR
;0;Collectivité et territoire d'Outre Mer;Overseas collectivity and territory;FR
;0;(Autre) Collectivité territoriale ;(Other) territorial collectivity;FR
;0;Région ;Region;FR
;0;Commune associée et commune déléguée ;Associated municipality and delegated municipality;FR
;0;Section de commune ;Section of a municipality;FR
;0;Ensemble urbain ;Conurbation;FR
;0;Association syndicale autorisée ;Authorised trade union association;FR
;0;Association foncière urbaine ;Urban land association;FR
