abbr.;LEN;full_name_local;full_name_english;country
 Ö.-r.AG;8; Öffentlich-rechtliche Aktiengesellschaft;Public limited company, governed by public law;BE
 VZW PR ;8; Vereniging zonder winstoogmerk van publiek recht ;Non-profit association, governed by public law;BE
SAM DPU ;8;Association d'assurances mutuelles de droit public ;Mutual insurance association, governed by public law;BE
 OVV PR ;8; Onderlinge verzekeringsvereniging van publiek recht ;Mutual insurance association, governed by public law;BE
 Ewg-Bwg;8; Entwässerungsgenossenschaft - Bewässerungsgenossenschaft;Polder - watering;BE
SC SCRI ;8;Société civile sous forme de société coopérative à responsabilité illimitée ;Non-trading company in the form of a cooperative company with unlimited liability;BE
SC SCRL ;8;Société civile sous forme de société coopérative à responsabilité limitée ;Non-trading company in the form of a cooperative company with limited liability;BE
 BV VOF ;8; Burgerlijke vennootschap onder vorm van vennootschap onder firma ;Non-trading company in the form of a general partnership;BE
 ZRG OHG;8; Zivilrechtliche Gesellschaft in der Rechtsform einer offenen Handelsgesellschaft;Non-trading company in the form of a general partnership;BE
 BV GCV ;8; Burgerlijke vennootschap onder vorm van gewone commanditaire vennootschap ;Non-trading company in the form of an ordinary limited partnership;BE
 ZRG EKG;8; Zivilrechtliche Gesellschaft in der Rechtsform einer einfachen Kommanditgesellschaft;Non-trading company in the form of an ordinary limited partnership;BE
 BV CVA ;8; Burgerlijke vennootschap onder vorm van commanditaire vennootschap op aandelen ;Non-trading company in the form of a partnership limited by shares;BE
SC SPRL ;8;Société civile sous forme de société privée à responsabilité limitée ;Non-trading company in the form of a private limited liability company;BE
 ZvGPgbH;8; Zivilrechtliche Gesellschaft in der Rechtsform einer Privatgesellschaft mit beschränkter Haftung;Non-trading company in the form of a private limited liability company;BE
SC SAGR ;8;Société civile sous forme de société agricole ;Non-trading company in the form of an agricultural company;BE
 LOKPOL ;8; Lokale politiezone ;Local Police;BE
 PROJ V ;8; Projectvereniging ;Project association;BE
RCOMAUT ;8;Régie communale autonome ;Autonomous municipal company;BE
SCRI FS ;8;Société coopérative à responsabilité illimitée à finalité sociale ;Cooperative company with unlimited liability with a social purpose;BE
SCRL FS ;8;Société coopérative à responsabilité limitée à finalité sociale ;Cooperative company with limited liability with a social purpose;BE
 VOF SO ;8; Vennootschap onder firma met een sociaal oogmerk ;General partnership with a social purpose;BE
 GCW SO ;8; Gewone commanditaire vennootschap met een sociaal oogmerk ;Ordinary limited partnership with a social purpose;BE
 CVA SO ;8; Commanditaire vennootschap op aandelen met een sociaal oogmerk ;Partnership limited by shares with a social purpose;BE
 KGaAmsZ;8; Kommanditgesellschaft auf Aktien mit sozialer Zielsetzung;Partnership limited by shares with a social purpose;BE
SPRL FS ;8;Société privée à responsabilité limitée à finalité sociale ;Private limited liability company with a social purpose;BE
 ESV SO ;8; Economisch samenwerkingsverband met een sociaal oogmerk ;Economic interest grouping with a social purpose;BE
a.m.b.a.;8;Andelsselskab (-forening) begr. ansvar;Limited liability cooperative society;DK
s.m.b.a.;8;Selskab med begrænset ansvar;Limited liability company;DK
f.m.b.a.;8;Forening med begrænset ansvar;Limited liability association;DK
j.d.o.o.;8;Jednostavno društvo s ograničenom odgovornošću;Simple limited liability company;HR
Ek. för.;8;Ekonomisk förening (Ek. för.) ;Economic association (minimum three members);SE
 Gen.mubH;9; Genossenschaft mit unbeschränkter Haftung;Cooperative partnership with unlimited liability;BE
 Comm.VA ;9; Commanditaire vennootschap op aandelen ;Partnership limited by shares;BE
 Kankenka;9; Krankenkasse ;Mutual health fund / Mutual Benefit Society / National Union of mutual health funds;BE
FONDPRIV ;9;Fondation privée ;Private Foundation;BE
 CVOA CD ;9; Coöperatieve vennootschap met onbeperkte aansprakelijkheid, bij wijze van deelneming van publiek recht ;Cooperative company with unlimited liability, Participating cooperative, governed by public law;BE
SCRL DPU ;9;Société coopérative à responsabilité limitée de droit public ;Cooperative company with limited liability, governed by public law;BE
 CVBA PR ;9; Coöperatieve vennootschap met beperkte aansprakelijkheid van publiek recht ;Cooperative company with limited liability, governed by public law;BE
ASBL DPU ;9;Association sans but lucratif de droit public ;Non-profit association, governed by public law;BE
 ÖrVohGza;9; Öffentlich-rechtliche Vereinigung ohne Gewinnerzielungsabsicht;Non-profit association, governed by public law;BE
ETSPUBLI ;9;Etablissement public ;Public institution;BE
 BV CVOA ;9; Burgerlijke vennootschap onder vorm van coöperatieve vennootschap met onbeperkte aansprakelijkheid ;Non-trading company in the form of a cooperative company with unlimited liability;BE
 ZvGGugcH;9; Zivilrechtliche Gesellschaft in der Rechtsform einer Genossenschaft mit unbeschränkter Haftung;Non-trading company in the form of a cooperative company with unlimited liability;BE
 BV CVBA ;9; Burgerlijke vennootschap onder vorm van coöperatieve vennootschap met beperkte aansprakelijkheid ;Non-trading company in the form of a cooperative company with limited liability;BE
 ZRG KGaA;9; Zivilrechtliche Gesellschaft in der Rechtsform einer Kommanditgesellschaft auf Aktien;Non-trading company in the form of a partnership limited by shares;BE
 BV BVBA ;9; Burgerlijke vennootschap onder vorm van besloten vennootschap met beperkte aansprakelijkheid ;Non-trading company in the form of a private limited liability company;BE
SERVFEDE ;9;Autre service fédéral ;Other federal service;BE
REGCOMNL ;9;Autorité de la Région flamande et de la Communauté flamande ;Authorities of the Flemish Region and the Flemish Community;BE
REGBRXCA ;9;Autorité de la Région de Bruxelles-Capitale ;Authorities of the Brussels Capital Region;BE
COMMFRAN ;9;Autorité de la Communauté française ;Authorities of the French Community;BE
COMGERMA ;9;Autorité de la Communauté germanophone ;Authorities of the German-speaking Community;BE
AUTOPROV ;9;Autorité provinciale ;Provincial Authority;BE
 Provbehö;9; Provinzialbehörde;Provincial Authority;BE
COMMUNES ;9;Ville ;City / municipality;BE
 Gemeinde;9; Stad ;City / municipality;BE
 Prjverng;9; Projektvereinigung;Project association;BE
ASS SERV ;9;Association prestataire de services (Région flamande) ;Services provider association (Flemish Region);BE
 DIENSTV ;9; Dienstverlenende vereniging (Vlaams Gewest) ;Services provider association (Flemish Region);BE
 AutGemRg;9; Autonome Gemeinderegie;Autonomous municipal company;BE
RPROVAUT ;9;Régie provinciale autonome ;Autonomous provincial company;BE
 AUTOPRB ;9; Autonoom provinciebedrijf ;Autonomous provincial company;BE
 AutPrvRg;9; Autonome Provinzialregie;Autonomous provincial company;BE
Ass.CPAS ;9;Association de CPAS ;Association of public centres for social welfare;BE
 CVOA SO ;9; Coöperatieve vennootschap met onbeperkte aansprakelijkheid met een sociaal oogmerk ;Cooperative company with unlimited liability with a social purpose;BE
 CVBA SO ;9; Coöperatieve vennootschap met beperkte aansprakelijkheid met een sociaal oogmerk ;Cooperative company with limited liability with a social purpose;BE
 BVBA SO ;9; Besloten vennootschap met beperkte aansprakelijkheid met een sociaal oogmerk ;Private limited liability company with a social purpose;BE
FORME FS ;9;Autre forme à finalité sociale de droit public ;Other form with a social purpose, governed by public law;BE
 VORM SO ;9; Andere vorm met een sociaal oogmerk van publiek recht ;Other form with a social purpose, governed by public law;BE
SPFPL SCA;9;Société de Participations Financières de Profession Libérale Société en commandite par actions;Professional holding company Partnership limited by shares;FR
SPFPL SAS;9;Société de Participations Financières de Profession Libérale Société par actions simplifiée;Professional holding company Simplified joint stock company;FR
 PRIV ST. ;10; Private stichting ;Private Foundation;BE
 FEDEDIEN ;10; Andere federale dienst ;Other federal service;BE
 VLGEWGEM ;10; Overheid van het Vlaamse Gewest en van de Vlaamse Gemeenschap ;Authorities of the Flemish Region and the Flemish Community;BE
 BRUHOOGE ;10; Overheid van het Brusselse Hoofdstedelijk Gewest ;Authorities of the Brussels Capital Region;BE
 FRAGEMEE ;10; Overheid van de Franse Gemeenschap ;Authorities of the French Community;BE
 DUITGEME ;10; Overheid van de Duitstalige Gemeenschap ;Authorities of the German-speaking Community;BE
 PROVOVER ;10; Provinciale overheid ;Provincial Authority;BE
 GEMEENTE ;10; commune ;City / municipality;BE
 OPDRAVER ;10; Opdrachthoudende vereniging (Vlaams Gewest) ;Project entrusted association (Flemish Region);BE
 AUTOGEMB ;10; Autonoom gemeentebedrijf ;Autonomous municipal company;BE
 Ver.OCMW ;10; Vereniging van OCMW's ;Association of public centres for social welfare;BE
SA LABORAL;10;Sociedad Anónima Laboral;Worker-owned public limited company ;ES
SL LABORAL;10;Sociedad Limitada Laboral;Worker-owned private limited company ;ES
SPFPL SARL;10;Société de Participations Financières de Profession Libérale Société à responsabilité limitée;Professional holding company Limited liability company;FR
sp. z o.o.;10;spółki z ograniczoną odpowiedzialnością;limited liability company;PL
.. & Co. KG;11;Kommanditgesellschaft mit haftungsbeschränktem Komplementär;Limited partnership (fully limited) ;DE
.. & Co. OHG;12;Offene Handelsgesellschaft mit haftungsbeschränktem Gesellschafter;General partnership (partially limited);DE
S. COM. P.A.;12;Sociedad Comanditaria por acciones;Limited stock partnership;ES
.. & Co. KGaA;13;Kommanditgesellschaft auf Aktien mit haftungsbeschränktem Komplementär;Partnership limited by shares (fully lmited);DE
S. EN C. o S. COM.;18;Sociedad Comanditaria Simple;Simple limited partnership;ES
UG (haftungsbeschränkt);23;Unternehmergesellschaft (haftungsbeschränkt);Entrepreneurial company (limited liability);DE
